{
  "schemaVersion": 1,
  "producer": {
    "name": "Sunder.Package.Build",
    "version": "1.0.0",
    "language": "csharp"
  },
  "projectIdentity": "Example.Package",
  "configuration": "Release",
  "targetFramework": "net10.0",
  "inputFingerprint": "aaaaaaaaaaaaaaaaaaaaaaaaaaaaaaaaaaaaaaaaaaaaaaaaaaaaaaaaaaaaaaaa",
  "lockSha256": "6ea46e7a2e9dcfc2b04f221224cb61434dcc181bc53f540fe3b3f9527f36a93e",
  "packageId": "example.owner",
  "packageVersion": "1.0.0",
  "contracts": [
    {
      "contractKey": "minimal",
      "contractId": "example.rpc.v1.minimal",
      "contractVersion": "2.0.0",
      "exposure": "public",
      "source": "owned",
      "authorityKind": "package",
      "authorityId": "example.owner",
      "descriptorBytes": 487,
      "canonicalDescriptor": "{\"$defs\":{\"Empty\":{\"additionalProperties\":false,\"properties\":{},\"required\":[],\"title\":\"Empty value\",\"type\":\"object\"}},\"$schema\":\"https://json-schema.org/draft/2020-12/schema\",\"contractId\":\"example.rpc.v1.minimal\",\"descriptorVersion\":1,\"errors\":{},\"schemaProfile\":\"sunder.rpc.values.v1\",\"services\":{\"example\":{\"methods\":{\"ping\":{\"errors\":[],\"idempotency\":\"idempotent\",\"kind\":\"unary\",\"requestSchema\":{\"$ref\":\"#/$defs/Empty\"},\"responseSchema\":{\"$ref\":\"#/$defs/Empty\"}}}}},\"version\":\"2.0.0\"}",
      "descriptorSha256": "709c513e8ce97618f8a5fefdf3b7de92c8ed673a7d657ba151b279d527c0d371",
      "abiSha256": "999c92cc5041ca77b2acabeab94a5bf0887117a8005ec3fa709564dc95902a42",
      "modelProjection": {
        "models": {},
        "serviceReferences": {}
      }
    }
  ]
}
