{
  "schemaVersion": 1,
  "producer": {
    "name": "Sunder.Package.Build",
    "version": "1.0.0",
    "language": "csharp"
  },
  "projectIdentity": "Example.Package",
  "configuration": "Release",
  "targetFramework": "net10.0",
  "inputFingerprint": "aaaaaaaaaaaaaaaaaaaaaaaaaaaaaaaaaaaaaaaaaaaaaaaaaaaaaaaaaaaaaaaa",
  "lockSha256": "48300c172fe8e323956ee95aa7cde02e30ca9ebd330179e328e3209fe31ead5a",
  "packageId": "example.owner",
  "packageVersion": "1.0.0",
  "contracts": [
    {
      "contractKey": "optionalReference",
      "contractId": "example.rpc.v1.optionalreference",
      "contractVersion": "2.0.0",
      "exposure": "public",
      "source": "owned",
      "authorityKind": "package",
      "authorityId": "example.owner",
      "descriptorBytes": 2034,
      "canonicalDescriptor": "{\"$defs\":{\"Context\":{\"additionalProperties\":false,\"properties\":{\"executionTarget\":{\"$ref\":\"#/$defs/NullableReference\"},\"strictTarget\":{\"$ref\":\"#/$defs/Locator\"}},\"required\":[\"executionTarget\",\"strictTarget\"],\"type\":\"object\"},\"Empty\":{\"additionalProperties\":false,\"properties\":{},\"required\":[],\"type\":\"object\"},\"Imported_Context\":{\"additionalProperties\":false,\"properties\":{\"executionTarget\":{\"$ref\":\"#/$defs/NullableReference\"}},\"required\":[\"executionTarget\"],\"type\":\"object\"},\"Locator\":{\"additionalProperties\":false,\"properties\":{\"abiSha256\":{\"maxLength\":64,\"minLength\":64,\"type\":\"string\"},\"activationEpoch\":{\"maximum\":9007199254740991,\"minimum\":0,\"type\":\"integer\"},\"activationId\":{\"format\":\"uuid\",\"type\":\"string\"},\"contractId\":{\"maxLength\":128,\"minLength\":1,\"type\":\"string\"},\"contractVersion\":{\"maxLength\":256,\"minLength\":5,\"type\":\"string\"},\"descriptorSha256\":{\"maxLength\":64,\"minLength\":64,\"type\":\"string\"},\"endpoint\":{\"maxLength\":256,\"minLength\":1,\"type\":\"string\"},\"packageId\":{\"maxLength\":128,\"minLength\":1,\"type\":\"string\"},\"packageVersion\":{\"maxLength\":256,\"minLength\":5,\"type\":\"string\"},\"providerId\":{\"maxLength\":128,\"minLength\":1,\"type\":\"string\"},\"sessionGeneration\":{\"maximum\":9007199254740991,\"minimum\":0,\"type\":\"integer\"}},\"required\":[\"packageId\",\"packageVersion\",\"providerId\",\"contractId\",\"contractVersion\",\"descriptorSha256\",\"abiSha256\",\"activationId\",\"activationEpoch\",\"sessionGeneration\",\"endpoint\"],\"type\":\"object\"},\"NullableReference\":{\"oneOf\":[{\"type\":\"null\"},{\"$ref\":\"#/$defs/ReferenceAlias\"}]},\"ReferenceAlias\":{\"$ref\":\"#/$defs/Locator\"}},\"contractId\":\"example.rpc.v1.optionalreference\",\"descriptorVersion\":1,\"errors\":{},\"schemaProfile\":\"sunder.rpc.values.v1\",\"services\":{\"example\":{\"methods\":{\"borrowed\":{\"errors\":[],\"idempotency\":\"none\",\"kind\":\"unary\",\"requestSchema\":{\"$ref\":\"#/$defs/Imported_Context\"},\"responseSchema\":{\"$ref\":\"#/$defs/Empty\"}},\"invoke\":{\"errors\":[],\"idempotency\":\"none\",\"kind\":\"unary\",\"requestSchema\":{\"$ref\":\"#/$defs/Context\"},\"responseSchema\":{\"$ref\":\"#/$defs/Empty\"}}}}},\"version\":\"2.0.0\"}",
      "descriptorSha256": "4a1b78eb73d9c42a7ca2af208f1ae6fd43f767200678cebe1c1ff5a1f2ccf033",
      "abiSha256": "412a5a3d1a06ec95644afe05436e033394fbac4dd3a330af06ffc68fbc009b0c",
      "modelProjection": {
        "models": {
          "Context": "SharedContext"
        },
        "serviceReferences": {
          "Locator": {
            "contractId": "example.rpc.v1.optionalreference",
            "serviceId": "example"
          }
        },
        "optionalServiceReferenceMembers": {
          "Context": [
            "executionTarget"
          ],
          "Imported_Context": [
            "executionTarget"
          ]
        }
      }
    }
  ]
}
